text,label
Sushi here is A come here during happy hour though that's when you'll get the best value for your dollar! Plus the happy hour menu is awesome.,2
"I got a pedicure here. Not bad, they were pretty thorough. But two days later both of my big toes were infected and oozing pus where she trimmed my toenails on the sides which was weird anyway . I hate to rate a local shop down, but man my toes hurt.",1
"They have pretty decent and authentic Mexican food. Pretty large menu so lots of options. I bit on the pricey side, but they make up for it by having 99 cent margaritas on Wednesdays.",2
"If you're into pinball at all, this place is amazing. It's a big room filled with pinball machines from all eras, along with a few assorted video games Paperboy! Tetris! It's free to get in, and you just pay 25 75 cents depending on the game. I brought five dollars in quarters and was entertained for quite awhile. n nOn a related note, I wish I had 950 to blow and more space because they were selling a Ted Nugent pinball game there for that price, and you know that'd be an awesome conversation piece. Whenever someone would go into my house, it would go something like this n nPerson ""Um, why do you have a Ted Nugent pinball game? "" n nMe ""It's the NUGE! "" n nPerson ""Okay. "" n nBut I digress. Anyway, if you're in Vegas, you should check this place out. It's only a couple of miles off the strip.",2
"Saw this new place at the Biltmore and wandered in, having no idea it was 'yet another Sam Fox concept.' Oy. Yes, the atmosphere is fine, and the people are pretty, and the dishes are acceptable, but. Why oh Why must the employees there be robots, automatons blindly following the company script? The server helping us must have been so new, or terrified of losing his job, that he was incapable of relying on any part of his authentic self. He was obviously told what to say to us upon approaching the table the dreaded ""Have you been here before? "" , what to say upon 'walking us through the menu' I have only read a menu like this 10,000 times before , what to say upon bringing each item to the table thanks, I know what 'street' tacos look like , etc. What does Mr. Fox fear? That his employees may have a personality that may ring true to diners? That we may accidentally have a genuine interpersonal interaction, if even for 30 seconds? And it wasn't just the server. We got the same from the hostess and the manager too. It's enough to make you lose your appetite. I'm outta here. No more Sam Fox for me.",1
"Oh Brio, I wish I met your happy hour sooner. n nFor your dining pleasure during M F, 3 to 7 M Th 9 to close , TUSCAN TASTERS FOR 2.95! Woop woop! Good quality food for such a little price. n nThe service was great despite the fact that the server was by herself or so I overheard . Sarah was her name. She managed to keep a smile on her face and was very polite. n nThe best plate from my happy hour was the Spicy shrimp and eggplant. The crusted eggplant had a sligh crunch and paired nicely with the black pepper cream sauce. However, the shrimp tasted spicier than the eggplant for some reason. n nThe Brio Burger was decent. Go for the other tasters instead. n nI also enjoyed the sliced steak bruschetta. The tender pieces of steak were topped with yummy gorgonzola. n nI wish there was drink specials on the menu. sad face n nThe seating area in the bar was very nice. There was two lounge areas complete with a love seat and arm chairs. Luckily, I got there in time to bag one! n nThe mini desserts looked so good but I choose just one. The vanilla creme brulee. The strawberries tasted so well with the vanilla custard. I which I ordered three of them! One was simply not enough! n nBrio! I've never been to Italy but I think you just gave me a small taste of it!",2
Not worth the time. Most of the dispensers were empty. Giving sample of fudge that were so small you had a hard time finding it. When I commented. To the lady she said they didn't want to use to much. nThis is an M M world want to be but does not measure up.,1
"I've switched to Dr. Bakerink about 6 months ago and happy so far. Dr. Bakerink takes his time with my boys and provides plenty of time for me to ask questions. Office staff is very friendly and professional. Very easy to schedule an appointment since they are very accommodating. Walk in time is available from 7 to 8 am, which is soooo helpful. The problem with the wait does exist, but just like in any doctor's office.",2
"Sub Par for a Westin restaurant, breakfast buffet was free which was the correct price.",1
Great local business! The owner and employees are friendly and helpful. Love to take our dog with us to shop. Its very dog friendly there. always a bowl of water for dogs to use. The home baked treats are a hit with our pup they have gluten free for him.,2
Love to come here for lunch and order the taco salad with Chicken. Came with our son today and his lunch was free. Great atmosphere as well.,2
They've stepped up their game as far as order times are concerned. Online ordering and menu items make this place a huge seller.,2
Always something different to see on each visit,2
"Finally, a bakery that makes healthy, gluten free muffins that honestly taste good! My favorite was the Sweet Potato Pumpkin. Tastes just like pumpkin pie in a muffin. There was also a good selection of other low fat, gluten free and vegan products such as cheese cakes, cookies, and nut butters with healthy, amazing ingredients. The staff was super nice and gave us several free samples.",2
"Eines vorweg In diesem Chinarestaurant habe ich bislang nur das Mittagsbuffet kennengelernt. Die Bewertung bezieht sich ausschliesslich darauf. n n n Mittlerweile gehen wir einmal w u00f6chentlich zu diesem chinesischen Restaurant. Das Buffet wird st u00e4ndig aufgef u00fcllt, so dass es fast immer genug von allem hat. Meine Lieblingsgerichte hier sind die acht Kostbarkeiten und das H u00fchnchen in Curry. Fazit Solide Kost zu einem vern u00fcnftigen Preis ohne Wartezeiten.",2
"Seriously? Can you even think of writing a bad review of In N Out? n nI do love the burgers here. I order mine protein style no bun so flippin yummy! n nThis place is busy, and that is fantastic, I love to people watch and eat tasty burgers! Animal style fries, oh yes lord!",2
"I have gone to Andy's nails twice to get my nails done, and a few other times to accompany friends. The place is clean and smells good no overpowering nail polish smell , and they are always on top of everything. Even if you had no appointment you will still be taken care of fairly quickly. nI have gotten acrylic nails done here twice now, and I was completely happy both times. My only complaint at all is that they are a tad bit overpriced. nOther than that they are great, they have a TV to watch while you're waiting or sitting getting a mani pedi, the staff is talkative so it isn't awkward just sitting there, and the atmosphere is good. They are convenient for the people who live near Gilbert Riggs because they are the only nail place close by. I recommend them.",2
"The store is amazing and the chocolate fountain is awesome. This review is for the customer service. nI have never been here before and asked the cashier ""how sweet are your iced mochas? "" The response ""well it's chocolate. "" Great! I know that. Are we talking one pump? Two pumps? Am I going to walk away diabetic?! n nI know you are hating your life as every child in Vegas wants a gelato but for those of us who want coffee, AND don't want to drink a milkshake, put on a smile and pretend to give a sh t about customer service. n nThanks!",1
I don't usually go to buffets because I don't eat a lot to begin with. But I was super hungover and hungry so we decided to check it out. We went to the lunch buffet and it was just ok. Nothing spectacular. I read in previous reviews the breakfast buffet is better. If I'm at this hotel again I would be willing to come back to try the breakfast.,1
"Only reason to be here if you really want one n You have the 24 hr BUFFET pass.and are a craving fruits OR b want to drink until you drop on bottomless cheap beers Coors Miller Light or house wine ask for a price of 10.without hitting the casino clubs pubs 7 11 n nAs for all else n the food is SUB PAR.and as expected ie clams mussels are.UGH, a disaster prime rib is at its RUBBER prime.and the New York strip.is as hard as the New York Brick that makes up Wall Street Mexican food section looks and tastes like it was rummaged out of a trashcan SERIOUSLY n can't say much about service when you're a platinum diamond holder but by observing other tables.they are pretty nice! n OH YEAH, while normal guests have the cold crab legs, Platinum Diamond section gets STEAMED crab legs, which, IMHO, are a LOT better n nAmbiance n lots and lots and LOTS of elderly people I'd say that's a good thing if the food was GREAT because the lines to any great items would be SHORT .BUT as mentioned earlier, the food is pretty much sub par.",1
Stayed at TI the weekend of 7 22 7 24. If you drive to Vegas like I did you will find parking at the hotel very convenient.the parking garage is located right off the freeway at Spring Mountain Rd.no hassle dealing with Las Vegas Blvd. traffic. n nCheck in process was very long around 11 30 AM.roughly 30 minute wait. n nRooms were decent for 75 night. Beds were very comfortable and the room was clean and looked newly renovated. TV was on the smaller end but then who watches TV while they are in Vegas. n nCasino was nicely laid out and I was always able to play one of my favorite games. n nThe location of TI is in a nice spot if you like visiting the hotels on the north strip. There is a tram that will take you to the Mirage and from there you can easily walk to Caesars or Bellagio. You can also leave TI and walk to the Wynn or Venetian which is across the street. n nOverall the hotel is a great value. Other hotels in this area are asking 200 night weekends . This hotel works well if you are on a budget and looking to crash somewhere comfortable. If you want the complete experience like ultra clubs and great restaurants you might want to look elsewhere.,2
"Food 1 star. All through out college I tried very hard not to succumb to birthday dinner peer pressure. The gritty sauce is not good I always leave nitty feeling like a train rammed into me. For a good burger, try dotty. nBar 3.5stars only worth going during power hour. They raised the prices since I went to college, now a whopping 1.25 for a mixed drink, Madison I think I can afford this the music is always Good but never new top hits, the place is packed. I would never stay. Here past 11 15, leave go to another bar! nSKIP the FOOD.",1
"My wife and I were visiting from Southern CA and had a hankering for sushi. If you appreciate fine sushi, DO NOT eat here. The restaurant is somewhat dingy, and the sushi chefs are not overly responsive. We ordered a rainbow roll that was halfway decent, but the crunchy roll was horrible and had dried noodles on top. This place deserves a pass .",1
"This is probably one of my favorite places in Westgate. The beer and a shot specials are usually what i end up with. For only 7 bucks for a blue moon and a shot of jager it is hard to beat. They have a really good selection of music with the videos playing on numerous tv's. The crowd is relaxed and usually is not difficult to find a place to sit. nOne thing I have learned the hard way , is when you are sitting on the couches enjoying a frosty cold beverage, watch out for the shin height steel tables that will jump out and bite you.",2
"omg Becky, look at the white flour on that pizza. okay not only is this pizza NOT very good, but every time I order on line they mess up my order. I am so done with you Papa John's. When I moved I thought well this is the only pizza joint nearby that delivers but I have since found a few others to try. I only went to you out of inertia. Do NOT, Do NOT try to trick me with the free pizza award for my latest complaint that you gave me extra sauce when I ordered light sauce. Because i will THROW it away. I hope I will be giving some other delivery pizza joint a good review soon.",1
"Why why why don't I play laser tag more often? It is SO much fun! And I think the prices here are quite reasonable. I compare many things to the price of a pint in MTL which I'd say is around 7 8.One game 20mins of laser tag was less than 10 , so like an expensive pint of beer, but for your additional toonie you get n To stalk your friends in the dark or strangers, whatevs n To pretend you are in an action film! n To trash talk! And to come up with a super cool handle n To run around, up and down, or just chill in a corner and shoot laser beams at an angle into a mirror to shoot unsuspecting victims. nWhat's not to love?! If you have a group and on a timeline, make a reservation! We showed up on a saturday at 5pm and had to wait til 6 15 to play but luckily those pints I was referring to earlier were just around the corner to hold us off . We were 9 ""adults "" questionable and fun was had all around. Enjoy!",2
"Do not go to this location. I've been going to the scottsdale and Shea location for years and the food and service there are just better in every way. Maybe a managerial thing? Let's start with probably the worst hostess I've ever dealt with at any restaurant. Went at almost 9pm still a little busy. She told us the wait was 15 mins but I saw at least 3 tables that just haven't been cleaned so I say we will wait. Then she points to 2 open bar stools and says you can sit there if ya want. No thanks. We wait 15 for the tables to get cleaned, and we go to the little middle section with probably 4 out of 6 booths open and she sits us at the tiny table with 2 little chairs? Um no we'll take a booth. She rolls her eyes throws the menus on the booth table and walks away. Just rude in my opinion. Your job is customer service. Wash dishes if you hate dealing with people. Been in the restaurant business for 20 years and would never hire someone like this. Service was good. Pizza had a giant burnt bubble but it wasn't bad. Meatballs were also good. Shrimp scampi had no taste though. Pizooki was good but that's hard to mess up. Take the 15 min drive to the better location on Shea.",1
EEk! Methinks not is right! The food here was terrible. It's pretty bad when you walk into a buffet hungry and leave still feeling hungry.,1
"First to review, now the last. nStopped by to see Hiro and Shige at ""Shiro Sushi "" last night and there is a note on the door. n n ""Couldn't make it through the slow times "". n nToo bad. nHopefully we will find them elsewhere soon. nTJ",1
"Thai Dressing Fine Thai Cuisine was a great first Thai experience for me. I enjoyed it so much that I would not mind going back again. The people and service also made the dining experience wonderful. The restaurant is not too large or small everything is clean and neat. Waiters are ready to help when ordering and they give helpful opinions on dish selections. My waiter was hard working, helpful, and attentive. The atmosphere is calming and quiet enough to enjoy your meal. n I ordered the Thai teriyaki chicken from the lunch menu. The dish comes with a Thai salad, white rice, and one vegetable spring roll. My main dish was sweet and had a distinctive taste from all the vegetables. It comes with baby corn, sliced carrots, onions, thinly sliced lettuce, green bell peppers, pineapple, and sliced apples. The vegetables were crunchy and fresh tasting but the apples gave the dish an unusual taste, to me. I did not prefer the apples since it made the meal extremely sweet. You can immediately tell the difference in the Thai dish style compared to the typical Chinese version. It was a nice change and a delicious version of teriyaki chicken. n My salad was the perfect portion for myself and tasted fresh. The small chopped lettuce, carrots, and red cabbage were crunchy and refreshing. The dressing was vinaigrette like with a sweet tangy taste. I enjoyed the flavors, simplicity, and uniqueness of the salad. Lastly, I ordered the homemade coconut ice cream. This also was a perfect portion for the cheap price. The ice cream had a yet rough texture, it was interesting to taste. The texture takes a little time to get used to but otherwise it is delicious. The first bite gives your mouth a bitter taste but after a couple of bites the ice cream becomes addicting. It was perfect for a warm day. I recommend Thai Dressing for everyone!",2
"Wellington, toffee pudding and Mac and cheese was DELISH! My friend had the steak and they said it was amazing ",2
"So, it took awhile, but I finally made my way into Luci's recently. I was driving southbound on 16th street and made a spontaneous decision to stop by. I'd done this once before, but it was when they were closed due to the fire at nearby Richardson's. But, they are re opened now, and they are still on fire. this time just metaphorically speaking . n nI ordered an iced tea at the coffee bar and browsed around a bit. I bumped into Ken, the owner, who gave me a bit of history and a tour of this adorable boutique ish neighborhood grocer. I learned that they revamped their staff from their initial opening, including hiring Chef Eric Guerin, and while I didn't eat while I was there, I will for sure be back to do so soon. the menu looks great especially their omelet selection! n nI could've spent hours looking around they carry a variety of unique health food, vitamins, and eco freindly natural products. I ended up purchasing some vitamins thanks Lucia for your help with that and a citrus smelling Weleda brand natural deodorant I hear so many bad things about regular deodorant, so I am going to give this stuff a shot . n nMy next visit to Luci's will be sooner than later for sure. I can tell, I'd be a regular if it was a tad bit closer to home.",2
Buffalo Wild Wings always great!,2
Got a groupon for 50 minute massage and 50 minute body scrub with hand foot treatment. That's the only part that made it decent. The body scrub lasted about 35 minutes and they counted me showering as the other 15 minutes. The massage was mediocre but I felt like the therapist wasn't properly trained. He really only did a roller style massage with his forearms and elbows. Little to no kneading. I asked for more but didn't get it. Would not go again. Premises were ok but nothing special. Sauna and showers. Relaxation room,1
"I heart Paint Monkey. The regular painting sessions are great, but the best is ""Paint Your Pet. "" After sending in a picture of your pet, Joe sketches it out for you. You leave with a painted portrait. n nBYOB is a lot of fun with friends hey, or yourself and after a few minutes you feel like you're right back in art class in elementary school having a fun time while the jukebox plays. n nA definite ""to do "" on a quiet night, or when company comes to town.",2
"Air conditioning is controlled. Had it set at 60 to see if it would get any colder. Temp said it was 69. Yeah right. I brought my own thermometer because this had happened before. It was actually 78 in the room. Shower design is super lame. Shower width is 1 2 glass, and no door. Water goes everywhere. I have stayed here a few times to confirm consistency and give them another chance. Same every time, in every room. Internet is sporadic, terrible at best. Connects and disconnects constantly. Stewart and Ogden rest is terrible. Food sucks once u get it . Waited 20 minutes to be seated, when half the rest was empty, then took 30 min to get food! Only give you roll of toilet paper on roller. No spare. If you want coffee, you must get it downstairs. All cabanas are empty because you have to spend 150 to get one. No comps on those. Just trying to keep it real. This place is a real bust even if you are comped rooms!",1
"I never want to come back here, which is so disappointing because their location before this one was wonderful. My boyfriend really wanted to come, since he was craving it so badly. n nThe waitress there didn't even ask us whether we wanted a booth or sushi bar table, she just assumed we wanted the bar table. She kept coming back and forth to us wondering if we were ready to order. Come on give us some time to at least look at all your selections. They only serve main entrees during lunch hour, which is strange because I wanted something else that's not sushi related. The appetizers were WAY too over salted. The edamame was covered in salt and half of them were cold and half hot. The seaweed miso soup was just way too overpowering of saltiness, had like 1 tofu and 1 seaweed in it. n nThe only thing keeping me from not going 1 star was the sushi rolls. My most sincere compliments to the sushi chefs because it was delicious. I got the tiger roll and 007 roll. My boyfriend did all you can eat and he thoroughly enjoyed the food as well. n nAnd lastly, the waitress never asked us if we'd like any water until we were almost done with our food. She also never mentioned that a refill on hot tea would be an extra charge. And she kept hovering over us like she wants us out and to hurry up and pay the bill. There was nobody there but another couple. Not sure why she wanted us to hurry up. Whatever, regardless never coming back. I'll go to a closer sushi place by my house thanks.",1
"I'd give this place 3 stars but the drive through line was about 12 cars deep, so we went inside. It took 10 minutes to get our food after ordering. Coulda been a bad night or a bad time 9 30pm but this isn't the first time the lines have been really long here. n nFood is normal, wait is not.",1
"Buddy and I had drinks and ate at the bar. It was a Friday night but a little early so it was fairly quiet. My buddy had Meesa wings and Sliders which he said we just OK, I had caesar salad and gnocchi, both were just average. Not good considering the tiny portions and slightly high prices. Not that it affected my rating, but to make things worse, both my friend and I had upset stomachs the rest of the night, while he actually had bad diarrhea through the next day let's just leave it at that. I will say the bartender was really friendly and made us some good drinks.",1
Food sucked. Strawberry's were kinda fresh. prices way too high. no more chicken up grade available. prices too high,1
"Ate here a few times since 2004. Haven't been in many, many months. Love all but one of the pasties I've tried, thus far. Great to know that you can call ahead to custom order! Also, you may call ahead and have your order started so that it's ready by the time you arrive! It took one of my pasties 50 minutes' preparation and cook time from phone call to my table! n nBest to order a few and share! Keep in mind, one of these pasties could contain up to 1200 calories or more! One word BUTTER. n nVegan pasties are also available, but you must call ahead to have them made.",2
"Great place! Took a little work to figure out getting a reso but when I did everything was smooth sailing. They took great care of my kid bonus points duh BUT we were smart enough to make my reso early to be the first turn. Food was great, wine pairing my choice was great. Take advantage of the Cammeron Hughes selection I didn't know that was available until too late but I did not feel bad about the Bella Glos selection at all. We will be back, we will request the same table, very easy nice outing for a celebration.",2
Do what ever you can not to rent at Dollar you may save 2 bucks a day but the 1 hour and 45 minute wait is not worth it. nHonestly two people are at the front desk nAnd at least 45 to 60 renters in front of you nThe front desk try's to sell you everything extra and wants to warn you about all the damages your going to incur nTalked with the Manager Mark he is a big fat butt about 60 years old who doesn't give a Sht about his customers and the front desk people completely reflect his attitude stay away at any cost awful,1
"After Margaret Cho, me and my crew went over to Amsterdam, and it being my first time, I was super excited because I had heard a lot about it. n nWe got there around 10pm and it wasn't super packed, which was nice since I got to use the ladies' room and we got our drinks rather quickly. The place is HUGE and there's a lot of room for dancing and lounging and socializing. Slowly but surely people started filling in, and we met a super nice Drag Queen Kiki and so we stayed to watch her thing at midnight. n nDrinks were generous, the people were nice, and I will definitely return.",2
I give this place 2 stars.why you ask.simply this. I know a good burger when I eat one and this was not it. No doubt was it a solid effort on trying something new with incorporating beer with cooking the burgers but it just wasn't there. The flavors just weren't there. Also My burger just fell apart at the end. If they would try using a brioche bun instead it will also help keep the burger stable when compiling all those topping we love so much. There are so many great places In las vegas to get a burger and this is not one of them. Two thumbs down.,1
