text,label
"This place is waaaay overpriced for the quality of food. I had two of the specials, grilled portobello mushroom and sea bass. The portobello was drenched in balsamic vinegar. Don't get me wrong, I love balsamic vinegar. I can just dip my bread in it plain but this was a very strong type and there was so much of it that I couldn't taste the mushrooms. As for the sea bass, I had asked for the olive oil drizzle to be removed and brought on the side since in most restaurants in the Burgh, drizzle means drench but it came with it anyways. When I complained, they took the fish and put it on a new plate with the olive oil scraped off. The sides that came with the entree were just sad. Some steamed veggies that tasted no different than steam in a bag grocery store variety and a bland rice with some peas. nThe bill for these two plus one glass of wine was 55. I had a groupon but it was still way way overpriced for the quality. The only reason I am giving them two stars instead of one is I should have asked for the price of the specials. I just assumed that the price of the sea bass would at least be comparable to the grilled salmon, which was 21. I was wrong since it was 35 despite being the size of my fist. nI will not be going back to this place and I do not recommend this to anyone who values quality over quantity.",1
I dont get how this place has so many great reviews. Customer service was terrible. I stopped in to discuss a cake for my housewarming. I arrived about 45 minutes before closing time but felt like i had completely inconvenienced the woman by stepping through the door. She seemed completely uninterested in listening to my ideas. I had the distinct feeling that she just wanted me to leave and quit bothering her. trying to salvation an unpleasant experience i bought a couple of cupcakes to take home. They certainly didnt make up for rest of it. Absolutely nothing special.,1
"Went with my daughter during my work lunch break. I had a restaurant coupon and since it was within walking distance from my workplace I decided to try them. n nIt is in the Roosevelt District, artsy, organic.so don't let the outside turn you off. When I went in, the establishment was clean including the bathroom which was operational . Christine was our server and she was very personable and informative. Since this was our first time at the restaurant she did recommend the Carnitas Torta. I am not a vegan or vegetarian but don't need meat everyday. This torta was made with Jackfruit n which she had to explain to me because I had never heard of it and cabbage. with the Chipotle and spices, it was WONDERFUL. It had a meaty taste and texture and all the flavors just came together. Even though it came with two halves, I could only finish one. My daughter finished both halves of her order, but neither of us felt stuffed after wards. My beverage was the fresh squeezed lemonade, sweetened with sparkling water. You can also have it unsweetened or with still water. It was just enough sweetness. My daughter had a Horchata. She said it was okay for a vegan version, but said she wouldn't order it again. n n I didn't order any desserts, but with the enjoyable experience we had, we will be returning.",2
"Groupon introduced this nice little place to us that was more than a wee bit away from the strip. n nIt truly was a miniature golf course as the name implies. It's not the mini golf courses you'd find as places like Scandia with the windmills and trick holes. It's as if they found a real golf course with the greens, rough, and sand traps and shrunk it. n nFun all the way around!",2
"If I could give this place the shadow of 1 star I would! I picked up my doggy and didn't think anything until the poor thing couldn't stop licking all his paws. I began to check him out and he turned out having a huge gash, open wound underneath his left eye! It looked like raw skin, I had to treat him with antibiotics. The reason why my dog was licking his paws was also because they were all cut up. When I originally picked him up, he was wearing this adorable bandana but when I removed it, there were patches of hair on his neck that weren't groomed. I'm feeling like the worse pet owner for having brought my pup here. n nTerrible service, would never put the life of my pup on their hands again!",1
"The pizza is excellent. I had a thin crust pie with amazing sausage, sun dried tomatoes and cheese! This is a wonderful place to get great food and a cold beer. They had Left Hand Milk Stout and 90 Shilling on tap which is always a plus. Prices are very reasonable, and there are literally dozens of TVs to watch any game that is on. The staff was very attentive and friendly. Can't wait until it warms up a bit so I can sit out on their nice patio.",2
The place just isn't the same since Lee sold out. I've tried to stay but at some point the wide selection of glitter and polishes does not outweigh technicians who don't know what they are doing and who are rude. I need a new place ,1
"A group of 16 of us were out of town and decided to go over to stone mountain grill. The manager told us he could not sit all of us together as we had such a large party even though you can make reservations online for 20 people. He said it would be to much for the waiter or waitress and we would all have ro sit seperately. He suggested next time we call a week ahead of time. Are u kidding me! We walked out, as to us that was not true service and they did not deserve our money!",1
"I think I had th 14 with taco cheese enchilada an chilly relano. "" gringo spelling "" for 5.50 cant beat it with a stick. great deal an the food amazingly good .very nice 4 the price .",2
"A nice change in pace when you get tired of the OG and Carraba's, the appetizers are tasty recommend the pesto bruchetta or the baked ravioli, the sauce is loaded with italian sausage and at times I find myself just eating the sauce with a fork, I'm a big fan of their calzone's lots of cheese, ample toppings puff's up like a good calzone should, the wait staff has been agreeable the times we've been there though we more often than not take out. I've also had the pizza and some pasta dishes and have been pleased with most, as I recall the sauces for one of the sausage and vodka sauce pasta's is ""very spicy "" and i'm not one to shy away from spicy food, so just a warning. n na good choice for italian in surprise",2
"O.K the outdoor seating on a bright sunny day was great. Service was fine. Wife wanted the half portion of fruit salad. It looked tired.some of the green grapes were turning yellow and only grapes and pineapple?. If you want a fruit salad bellagio cafe does much better. I ordered a bloody mary, at 12 no celery or olives? Sky Box grill at Aria has a 10 B.M that will rock your socks off. Had the fish tacos 2 for 12 . While the fish was fine the salsa was weird. Ate 75 of one of them and gave the wife the other. At about 40 with tip I can't say I was happy.",1
"Had dinner tonight, service was excellent food was lousy. The lamb chops had to be sent back 90 fat was no meat on the traps at all. Or the reserve a bone in New York steak came very dry the waiters will kindly replace both with fillets which were tasty. However, I make it better on my home real with me I buy from Cosco. n nMild Italian should start shopping at Cosco. They sell prime beef. n nTo quote my late father, ""now I've been there twice. The first time, and the last time. """,1
Great food great service. Best filipino food in vegas. And the filipino employees make you feel at home,2
"Not my choice for breakfast. Only reason I've come here is Amy C. likes this place for breakfast and being the good friend that I am, I oblige. I've been here and waited an obscene amount of time, and I've been here and seated right away. The menu isn't impressive. I swear it takes me longer to decide on what to eat than it does for them to prepare it. I've tried the Eggs Benedict and don't think anything of them. I am not a fan of breakfast potatoes, I prefer hash browns. That's a big negative on this place. I was craving banana walnut pancakes one time and I asked if they could make them, so I receive my pancakes with bananas and walnuts on top off the pancakes. What the heck? Shouldn't they be mixed in with the pancake batter? I know I had a perplexed look on my face and the waitress wasn't interested in asking me what the problem was. I feel the food here is comparable to IHOP or Denny's, no quality. I also dislike that you have to go up to the counter to pay. Why can't I leave my check and the tip on the table and leave when I'm done! I can only hope I can talk Amy C. into Cracked Egg instead.",1
"One of the best Indian restaurants I have ever been too which says a lot because Indian food is my all time favorite. Went there for lunch on a Saturday and the place was packed. Great prices and large portion sizes with a pretty large menu. Try the tali lunch special which is a great bang for your buck. Options include their famous butter chicken, curry lamb, or a vegetarian option. Had plenty of leftovers and although the service was a little slow I could not be mad because there were only two waiters working and since it was so crowded they were running around the whole time. They were very polite and continuously apologized but like I said I couldn't be mad they were doing the best they could Cash debit card only FYI.",2
"I suppose it depends on what you get, maybe some meals are better here but my chicken sandwich was public school cafeteria level with a little bit more spice. I would have rather had McDonalds. The waitress also heavily exaggerated the portions. M wife got the appetizer sampler which was much smaller than advertised it was okay but again I've had better and we were told the Super Nacho plate was HUGE! It was decent I guess and probably the best of any of the dishes we had. n nWon't be returning anytime soon.",1
"Flamingo Palace is the closest thing to East Coast Chinese food I've found. The house chicken is super tasty and they have really yummy rice. nYes it's a little worn inside and that fish in the tank needs a bigger tank, but it's well worth a visit. Delivery was also very quick.",2
Poor service. n nMy bro in law was stabbed so he was admitted here. n nThe nurses wouldn't check on him. His catheter was full and they didn't change it until a few hours after we told them. n nHe was supposed to have his IV changed out and they didn't to it until the next day. n nThe nurses are pretty much bitches.,1
"I walked in to get information. The only worker there was a trainer that told me he was finishing up a private lesson and would be right with me. After 15 minutes of walking around looking at their displays and not finding any infomation on their services and the trainer not acknowledging I was still waiting.I left. I understand he was in a private lesson. However, he should have given me a timeframe or at least asked what I needed. If you only have one person working in the store, you have to come up with a better system or have information that someone can take with them.",1
"I had the stuffed pancakes, it was stuffed and big. The coffee was good and the service quick. I enjoyed my meal and had a great breakfast. The place was bug and can accommodate a lot of customers.",2
"Good food. Awful service. The waiter was nowhere to be found when we needed our check, even though we slotted 2 hrs to get through our meal, kept our order super simple, told our server upfront when we needed to leave. We had to ask 2 other staff and finally chase him down on foot as he walked away while we continually said ""excuse me. "" I won't be back.",1
"OOOO i remember when they were just starting to develop the waterfront and everyone was buzzing about this place! Haha! People were very excited for premium seating, alcohol and hot meals! n nOn the scale of theaters its nice! The place huge, tons of theaters, very clean, a great concession stand and comfortable seating. There is a big parking lot, so parking is never an issue. n nIf you are out looking for a place to catch a movie in Pittsburgh, Lowes is the go to.",2
"I'd like to update my review of Red Carpet VIP. Based on my experience, I would not feel comfortable saying that ""I'm a fan "" or even that they're ""A ok. "" My friends and I did get that refund we were waiting for. However, this was only after I had requested it more than once and been accused of lying. nI've added a star because a representative that I had not dealth with during my stay in Vegas reached out to me with an apology for our subpar experience and a promise of a better experience should I try their services in the future. nI am glad to read that other Yelpers had a much much better experience than my friends and I had. Hopefully, our experience was simply a fluke and not due to anything else.",1
Mmmmmmm.fresh doughnuts,2
"Been going here for over a year, and I've always come back for the great Chinese and Thai food. However I ordered delivery, which took about an hour an order of Fried Wontons which were hard and cold , Thai iced tea that was warm with a little ice in it, and Pan Fried Noodles. I didn't have a problem with the noodles until I started eating and as I was thinking how tender the beef was I found a METAL STAPLE looking thing IN THE MEAT. It hurt my tooth even. Will never order here again sadly. ",1
"I am definitely no expert on Indian food, but since this this place serves nothing that even resembles that, I feel qualified to offer my thoughts. Once you get past the dismal decor of the ""restaurant "" itself and figure maybe the food will at least be ok, you get a dish slapped into a takout plate by a pleasant woman. It all goes downhill from there. I ordered the vegan lunch which consisted of Eggplant , Tofu and Vegetables and Tomato and Lentils over rice. All three were substandard. The eggplant was ok, but did not appear to be fresh.was visually unappealing and basically not good. n nThe lentils and tomato served over mushy brown rice not basmati , was light on both tomatoes and lentils but was passable as food. But by far the worst was the tofu. Large cubes swimming in a disgusting broth were like sponges of awfulness. Biting into one resulted in a gushing of water that looked like it came out of the Ganges river, thereby establishing it's only tangential connection to authentic Indian food. . Thank Annapurna the Hindu God of food and cooking , for the half a slice of whole wheat pita that was laying on top of the rest of this slop. n nMy understanding from what others tell me is there are better things to order on other days of the week. But I don't plan to return .maybe when it eventually becomes a Subway or Starbucks. n nHoping I don't get sick. n nJim",1
"Normally i have an okay time here. My last visit wasnt even okay. n nI didnt even get a chance to eat here and had to leave due to the terrible service. We took a seat at the bar and ordered the deep dish pizza we were craving all diggity day long and a brown ale, along with a couple waters. Then we watched the bartenders behind the bar have internal drama and not even look in our direction as we waited.and waited.annnnnnd waited. Neither the bar nor the dining area was busy or even half full and i sat for 17 minutes without even the orders for the waters go fulfilled. nAt that point i had seen enough and had to walk out before the food and drinks even arrived. I hated to do it but i could not support the staff and business where that could happen. n nThe bottom line is that it was a bad experience but the food i have had here in the past has always been solid, the beer is surprisingly good and priced very well.",1
"Freaking amazing! n nWay over priced. but its something that you only do once. Unless you are crazy wealthy. The tickets we had were about 200 a piece because the cheaper ones were sold out , and if you don't mind sitting in the nose bleeds you can tickets for 100. If you can afford it. I would defiantly recommend it. n nThis is the 2nd Cirque Du Soleil show I've seen. the first being Myst u00e8re at Treasure Island. This one was even more amazing, and if you only get to see one show. make it this one! Don't be cheep. see this show. It is worth it! n nMy only complaint. that I forgot to take a camera.",2
"Just want to start this out saying 1 star is being very generous! We ordered the combo lunch sandwich, salad, drink . When asking what our drink choices were to go with the combo we were told soda, beer, coffee, etc. and no up charge total scam . We also asked for water for the whole table. The waiter returned with a pitcher of water no ice and 4 paper coffee cups that were previously used. There was lipstick on some of the cups, a lemon slice in the bottom of one of the glasses from the previous persons drink. When we called out our 12 year old waiter owners son he took the cups and returned with more paper cups that were previously used! Really? Who washes out paper cups and tries to reuse them? This was all before the food! Cold soggy fries salad with no dressing left us disgusted to say the least. We went to pay inside to discuss our billing and other issues to the 14 year old at the register owners other son and he was very unprofessional and started arguing with us in front of others that were waiting to pay also! They charged us for our drinks that were supposed to be included on the combo meal that we ordered. Don't waste your time and money coming here! There are so many great restaurants in Montr u00e9al but this is NOT one if them.",1
" Rating only on food nWhere to start. I guess I'll start with the good, then the bad as sadly there was some things that stood out that irked the party as well as came off a little ""odd. "" n nFor appetizers nWe ordered the Pork Belly, Deviled Eggs, and the Jumbalaya. It was all delicious, however the only question was on the deviled eggs was served on some wine menus. Is that to soak up water or something? Maybe it was to hint to get some wine? I've always known that whatever you place on the dish should be edible. Maybe they didn't get the memo My best guess is that is so it doesn't slide off the dish, but still there has to be a more creative solution. nThe Jumbalaya was the winner in the appetizer choices though. It had flavor and a little kick at the end to top it all off. n nEntre u00e9 nI ordered the 22 Oz ribeye steak. Oscar style. Which meant that there was crab meat on top Was it good? Yep. Do I suggest you to get it? Yes, only if you brought a big appetite with you because that was one pretty big ribeye. But of course, I finished it. nSides that you have to try out are the mac and cheese. Those are amazing. n nNow to the bad nOur waiter's name was Amy.and well some things went down before my brother and I got there and some things after I arrived. My party told me when I arrived about 20 minutes late that the waiter came up twice about when we were getting there. First telling my party that at 7 30 there was another table coming and that the whole party wasn't here. Second time complaining about when we were coming. n nNow when both of us came, I observed she was very touchy and feely. She caressed my mother's arm and then proceeded to ask her if she shaved her arms, and then went to my father and caressed his arm. what the fuck? Anyways, I saw her come back and then apologize for rushing us to order and the previous comments, however this was after we ordered 200 worth of food. I think she wanted to make sure she had a tip at the end. She continued to say that management was rushing her. Way to blame it on the people who hired you. n nShe constantly made weird comments throughout the night. Such as ""I got this cake from that table, because they wanted to give it to me. "" Or how about taking a customer's baby and then proceeding to introduce the baby to other tables. n nLet's just say, this restaurant is not a family restaurant. I'm pretty sure that's not the ambiance that they are going for. It's a pretty high class steakhouse.With some feelings from my party of being judged of not having enough money to pay for the meal to just weird comments or inappropriate touching of customers.It changes the experience. n nBut, if I was to solely judge the food. It's definitely a place to go eat, I definitely will be back again.but I'll ask not to get this waiter again, or else I'll switch tables. I know this is a 5 star restaurant in my books, but you know what they say, when the service is off the food will feel a little off as well.",2
"I'm sorry, but I feel I have to update my review and not for the better. Megabus just doesn't cut it for me anymore. Here are the reasons why n n1. Major, unnecessary attitude from drivers, esp. during busy times around Thanksgiving and Christmas New Year's . This includes reading passengers the riot act as soon as the bus gets moving with no particular reason, which includes threatening to leave passengers stranded, as well as unreasonable requests that passengers refrain from using scented lotion, etc. I've never gotten such attitude from drivers on either Greyhound or Amtrak, and I'm wondering if it has to do with poor pay and working conditions Amtrak conductors are unionized and paid better not sure about Greyhound . n n2. Inconsistent and overly strict baggage enforcement. My bags are under their specifications, and I've caught flak from drivers about it before. See other reviews for even worse complaints . In contrast, my bags are slightly over Amtrak's specs, and none of the conductors have ever said anything to me about it before. n n3. Cramped and uncomfortable seating, with little opportunity to get up and move around. I almost always felt cramped when I got off the bus. This became particularly apparent to me after I started riding Amtrak, which provides much more legroom. Seat pitch is about the same as Greyhound, so if you don't mind that, then you'll be okay, I guess. n n4. Poorly functioning amenities the wifi rarely works, and when it does, it's extremely spotty. I've also encountered power outlets that didn't work on occasion. Don't believe their advertising campaigns about either the wifi or power outlets! Neither Greyhound nor Amtrak make such claims, and although wifi isn't available on the whole train, if you sit in the cafe car, you can get it and it's pretty reliable, in my experience. n n5. Poor customer service this is the real dealbreaker for me with any business. As others have mentioned, if you accidentally book the wrong date or need to change your travel plans, you're SOL with Megabus. Even Greyhound allows passengers to change itineraries even though you have to show up in person and there's a 20 change fee! On Amtrak, you can change your itinerary without any change fee the only time you'll encounter an upcharge is if the fares are higher on the day that you want to change to. Not sure about refunds credits if the fares are lower. n nAbout the only factor Megabus has going for it are the inexpensiveness of the fares. Between all of the other factors listed above, I've decided that it's worth it to me to pay an extra 30 or so to ride Amtrak hassle free to Philly. As such, Megabus won't be seeing any more of my money again anytime soon!",1
"Some of the best service in Las Vegas. They always refilled me with juice and bread, and provided me with a Wall Street Journal to read. If you can afford to splurge a bit for a power breakfast, there is probably no better place in Las Vegas.",2
"I love this bar. They have amazing nachos and the staff is amazing Jaki, Kaleigh and Wayne. I don't ever have to wait long for a drink. Oh yeah and sex trivia on Saturday night is so much fun.",2
"Hands down one of mine and my family's favorite places! We visit often, and every time the staff is amazing! Very friendly. I would come here just for the spinach enchiladas and the Espinaca casserole alone, if you like spinach, these are a must!",2
"I bought some T Shirts for my kids from the shop when I was in Vegas and then by accident left the bag in a restaurant on the strip. I just wanted to replace what I lost for my kids since they are ticked off, so I go to their website to look for an on line store. n nThe on line store at www.gspawn.com has been broken for quite a while. You can't check out or create an account. Filled out the on line contact form weeks ago and no response. I guess they must not care because you'd think they would wonder why they aren't getting any orders. I even called the shop, selected the pawn counter, but it just goes to voicemail and the mailbox recording says it's full and no more messages can be accepted. n nThey should just take the shop off their website if they can't get it fixed. n nBTW The shop is small and sort of dirty. The carpet looks like it was last replaced in 1981 and they must not own a vacuum cleaner. Plus, It has that old building smell that catches you when you first enter. n nLike other reviewers stated, the actual pawned merchandise is over priced and a good third of the floor space is now dedicated to t shirts, mugs, bobble heads, etc. n nIf you are planning a visit, go after 5 00PM as there isn't much of a line then. If you go during the day, you will stand in line, but you may see some of the stars from the show. n nTravis and Andy, two of the shop employees, were extremely nice. As for Rick, he looks like he's about to pop an artery or two in his head.",1
