text,label
"Everything leading up to the massage is a little unorganized. There is no receptionist so it is difficult to make the appointment. You have to wait to be picked up in the hotel lobby. There is no spa associated with this massage room, but the room is very nicely decorated. Poor DJ runs the entire operation by himself and seems rushed and frazzled when you meet him. But as soon as he puts his hands on you all of that frustration and judgment melts away. He gives the best massage I have ever had. I was a massage therapist for 12 years and I now regularly get massages a couple of times a month. I have been bouncing around Las Vegas for the past year never repeating with the same therapist twice. nFinally I don't have to try anyone else. He was very talented and super nice. He really cares about his work and puts so much energy into his work.",2
Went to Tias for lunch. Not extremely busy. Had to flag down a waiter to get service. Wasn't offered the lunch menu either. Ordered our food and mentioned that we needed to place a to go order too. Server told us to remind him to place the order. Isn't that what a server is for? Reminded him after we got our food and when he checked on us. Got our tab and no to go food on tab. Paid bill and then he asked about to go order. Told him not to worry about it. He didn't apologize and acted like it was no big deal. Won't be back for a while.,1
"I've shopped at Target Stores all across the country, from New York to Seattle, and will have to say that this one is by far the worst. Nonetheless, they seem to do a lot of business, there's a backup at Checkout whenever I go, so you have to wonder how much better this location would do if they offered the value and customer service of other Targets. Last month, they held an employee meeting in the middle of the day in the middle of the store, the Bedding department. If you can imagine aisles completely empty of staff except in Bedding where a crowd of more than 15 are standing and those 15 employees jumping up and down exclaiming how great they were, then you get the picture. A customer walked up to the edge of the 15 crowd of employees and pleaded for help, saying he was late and need to find an item quickly. They paused long enough to laugh at him, then turned around and kept jumping up and down telling each other how great they were. If it wasn't so sad, it would have been hilarious! That is somewhat comparable to my experience, which just happened, where I was directed to Checkout 10 with the instructions ""No one is at that register. "", meaning, no customers were there, so no waits. I was thinking ""Wow, that staffer was very helpful. "" until getting to Checkout 10 and finding that the cashier had a stack of coupons she was going through, many of which would not scan. After waiting a very long time, I jumped into a different line and finally made it to the front. I handed the cashier a 20 off everything coupon which she set to one side and then rang everything up. Before she finished, I pointed to the coupon again and reminded her to knock 20 off the final bill. She didn't. She did apologize, though, saying it was not possible to void the sale and then give me 20 off, so since it was her mistake, she kindly walked me over to Customer Service where we gave an attendant the receipt and the coupon and told her we'd be back in a moment with the goods. All was set. Things were good. My opinion of this Target was changing. I got back to Customer Service in less than a couple of minutes and in that time a line had formed. The ""Customer Service "" rep who was assigned the task of refunding me 20 told me to go to the end of the line. I told her that wasn't our agreement. She said ""Go to the end of the line. "" I said ""Give me back the receipt as well as the 20 off coupon. "" After she did that, I said politely, thoughtfully, and kindly to her just to make sure she knew she had done something bad ""This is very disappointing. "" The clerk next to her mouthed the words ""F YOU! "". Wow! Finally, after what seemed like about 20 minutes after arriving at Checkout to pay for a few items, I was leaving with no 20 off and lots of misdirection and an insult I will never forget. But, that wasn't my worst experience at this store. You almost have to go there to see it for yourself!",1
"I have been here once for lunch and sat outside only to get eaten alive by flies, nothing worse than eating outside on a nice patio and being pestered the entire time. n nI decided to give it another chance for happy hour, well guess what? flies followed me inside too. n nI don't know if it was the time of year early spring or what, but they really need an exterminator!",1
CANDY CANDY CANDY. n nWhen you walk in it is fash back into the willy wonka factory. There is alot of candy selection and soda flavors. n nWe went during the week and it was very dead but the sales clerk was friendly. The store was clean and organized. n nIt is a fun place to go and check out for a quick sugar fix.,2
"Unlimited fries. n nIs there really anything to be said after this? n nOK, they are the thick cut steak fries. And never cold nor stale. n nEven when I get a take out burger, they will give me a whole box of extra fries. Who doesn't love that? n nBut the burgers are really good. Always hot, fresh, and well seasoned. n nI prefer to grab and go here, as it can get over run with kids, which, if you're not with your own, can be a PITA. n nI do agree with the other reviewers that being served a meal in a plastic red basket is a turn off. Can they swing a plate? You have to wash the baskets anyhow DON'T YOU? .",2
"Best toy store I have been to in phoenix. They wrap for free, they are very helpful at trying to help you pick the best gifts for the age you are looking for. They know their toys. They have a lot of speciality toys and educational toy. Fun place.",2
the restaurant is NOT open for 24 7! Who wrote that?! And I took a taxi just for a closed restaurant,1
"This hotel isn't worth the discomfort and poor customer service. I had the misfortune of staying 10 nights my options were limited due to a workshop's location . n nHampton charged 10 more night than what I was originally quoted. Since I couldn't remember the name of the employee who originally helped me they wouldn't give me the lower rate. n nOther issues n n hard uncomfortable beds n thin pillows n worn out feel to room common space Chipped scratched walls, counters bathtubs n terrible housekeeping service didn't always mop floors or take out trash n desk employees friendly but management has horrible customer service n side entrance card entry rarely worked n room keys don't stay programmed and constantly needed to be reset",1
"On a recent trip to Vegas, we got roped into the timeshare scam by Grandview Resorts. n nWe were approached on the strip by a blonde lady named Robin and offered two pairs of free show tickets plus a free buffet breakfast if we could suffer through an hour presentation after. We were told the hotel we'd be touring was just down the strip from where we were staying at Excalibur so we figured, knowing it would be sales pitch that we wouldn't take, two hours of our time was worth two free pairs of tickets. I really wanted to see a show while on vacation. n nUm no. All lies. n nWe boarded a charter bus from our hotel on the strip with a bunch of other suckers around 10 am. We drove for 30 minutes on the freeway. Got off the bus and were ushered into the lobby of some hotel in the middle of nowhere. Upon arrival, there was no food as promised. The saleswoman on the strip had insisted that we don't eat before we go so we were totally hangry at this point and annoyed that the hotel was so much further than we were told. n nWe waited in the lobby until 11 am. Some salesman retrieves us and has us get in another car to travel to yet another property 10 minutes away where we were told the food would be. We're about an hour in at this point. n nIn the car, we told the salesman that we were told the hotel would be on the strip. ""This is the strip, "" he replied. ""Technically, we're on Las Vegas Blvd still and this will all be connected by 2020. "" Seriously, dude? n nThat's when we asked to be taken back to the hotel and given our money back. We wasted 2 hours of our day. Got no free show tickets, no food and had to argue to get our money back. n nDon't fall for the scam! The 2 3 hours does not include travel time. It's more like 4 5. The hotel is not down the strip at all. They'll tell you anything to get you there. It's quite far from the strip and in the middle of nowhere. n nThere are plenty of ways to find discounts in Vegas on shows and other fun. You don't need to attend this scam for free tickets. Totally not worth it. n nPS The salesman said we could complain, but warned us that this was such a successful pitch that the company would not care about two people complaining. Comforting. n nShame on you, Grandview!",1
Great store. Went in looking for a good pair of basketball shoes. Customer service was great. Everyone wanted to help me. Had a nice girl get me the shoes I needed and was extremely helpful with her opinions. Had a great experience here.,2
"Great place to get a quick bite to eat when you are in the Cosmopolitan. n nService is adequate. first time we ate here, it was a tad slow, but the food was delivered quickly. the second time, the waiter was really good. n nThe burgers are awesome. I had the Gold Standard both times. Highly recommend. I wanted to try something else the second time, but couldn't get over how good it was the first time. Didn't try a shake, but that's for next time.",2
Excellent food and service. You can check out their menu in the picture's section on this page and visit and Like their new facebook page! n nhttp www.facebook.com pages Blossom Asian Cuisine 116172298411131,2
"I stayed here for one night after Pricelining a room for 80. Seemed like a smoking deal, but after taxes and fees from Piceline it came to 94. Then the hotel tacks on a resort fee of course. All of this is to be expected, just a friendly 'buyer beware.' n nPros n Located close to Aria and Cosmo shows, food, gambling, etc. n Great rooms with kitchenettes think of Vdara as the Residence Inn of City Center n Well decorated n nCons n Not the best value in the star range if you don't need the kitchenette. I'd reccommend 'THE HOTEL' or one of the Towers Planet Holleywood Towers, Hard Rock Towers, etc. n See below. n nWhen I checked in I was given a handicap room without being told it was one which I didn't appreciate . My room featured a huge stain in the middle of the carpet and a shower door that allowed water to leak out even when shut completely. I reported the shower issue, they sent engineering up, but the problem remained. n nSo when checking out I very calmly really showed the manager a video of the water streaming out under the shower door and expressed my interest in making sure no one else had to deal with this. She was mildly apologetic and offered to waive the daily resort fee. I negotiated a 50 credit at the cafe and called it a day. n nSo in my opinion, not the best customer service at least for escalations or issues . I am pretty easy and travel a lot. So every once and awhile I get to deal with issues. The manager on duty got a C in my book. I was so polite, friendly, fact based, etc. and got offered a free resort credit. Kind of disappointed!",2
Rude! Walked in an walked around for 10 minutes aimlessly and no one asked me if I needed help. Way to go MAC! This was one of my worst experiences at a MAC store ever. Just because I am not thin or blonde means you can ignore me.,1
"Boo for you Budget! n nI rented a vehicle via Priceline for the Thanksgiving holiday. Priceline guarantees the price which effectively means that Budget agreed to the price as a grand total. n nWell Budget had decided to rent all of the vehicles I had agreed to rent and instead of offering me a nicer vehicle at the same price they told me that I was going to have to pay 2 more per day. Now I know what you are saying ""Evey, 2 a day more is not a big deal "" and if price were the heart of the matter I would agree with you completely however, the real issue is that they knew I was coming, they had an agreement in place, they got rid of my car, forced me to rent a more expensive car, and it wasn't even an upgrade. n nI was supposed to have a 2010 Chevy Aveo or similar car I received the 2011 Chevy Aveo. That's not an upgrade. n nI had also used an upgrade code that my insurance company provided to me that Budget was supposed to honor. The upgrade was from the economy car to the economy plus or whatever it's called. n nWhen I pointed out the issue and the verbiage on the contract I had printed out the manager dismissed everything I said. n nFrankly if I hadn't paid in advance for the car on Priceline I would have walked away and rented from another company. n nThe one and only good thing about Budget at the airport the shuttle service is fantastic as were the two drivers I had interactions with.",1
I did not enjoy the lunch buffet. There wasn't as much variety as I've seen at other Las Vegas buffets and the quality was poor.,1
"RA is OK. I like Happy hour mainly for the cheap food and Saki beer. The sushi on the other hand is just meh! It's good but its not what I consider real sushi or quality sushi. It's Arizona Sushi! Coming from LA and San Diego, this would be pathetic sushi! But some it is OK and I can tolerate it at HH due to the prices. I would not go here during regular hours and regular prices.",1
"We went in to get small tattoos on our hands and they said they wouldn't do it because of ""moral standards. "" Not sure what that means, but they told us if we had sleeves or are very inked up they'd do it but since we weren't covered, they wouldn't. The guy said what if in 10 years we try to get a job and can't because of the hand tattoos? Umm that makes no sense. What does that have to do with them? They were very rude and short, and it literally made no sense what they were saying. No thanks!",1
"This bead store is definately worth going to. They have very good sales that seem to be happening all the time or at least around the holidays when I am in Phx , I always walk away with more than I intended. The quality of the beads isn't always what I am looking for, and I like to find very unique things which in this store you really have to search for. Overall, you can find all your basics and then some at a pretty good deal.",2
holy crap guys! update your website. you have posted memos and events dating early 2013. 2015 is around the corner. I even sent multiple emails to the director of the facility. Been over a month and haven't even received a courtesy email.,1
"Came in tonight around 7 30 with three kids and two adults and we were promptly seated. The waitress was initially prompt and took our order. The ordering process went smoothly with one exception in which the waitress stopped mid order to verify the price on a side order of biscuits. It seemed strange but she recovered quickly. The first salad came out very quickly and I thought ""Wow great decision for a Hungry group with kids. "" The food came out shortly thereafter and I was very satisfied with the fish fry. Normally I would rate the food a solid 3 stars and perhaps bump up the rating to 4 stars with great service, but unfortunately after our food came out, our waitress literally disappeared. We had to practically beg to get our drinks refilled and we went for long periods of time before she checked on us. The restaurant was not overly busy. I requested that the waitress bring a box out for the food which is normally a sign of ""hey we are ready to leave "" but it was at least 15 minutes before we saw her again to request the check after bringing us the box. It was really frustrating and because of the experience, I'm not sure I want to go back. The food is good overall, but I can get equally good food and much better service somewhere else.",1
"Restaurant Santa Lucia has a lot going for it great location, capable waitstaff, an enticing menu, and a seemingly skilled chef. This restaurant could really be great if they could improve on the quality of their ingredients. n nWe started out with an appetizer of escargot, which my wife usually insists on. The sauce was delicious, but the snails were obviously not fresh and that really killed the dish. n nFor entrees, I had a calzone while my wife opted for a veggie pizza. The presentation was great, and the homemade wood fire cooked pizza dough was fantastic. Once we hit the toppings though, the honeymoon was over. The onions in my calzone were raw and totally overpowering. My wife said most of the vegetables on her pizza tasted canned and were nearly inedible. We both picked everything off and ended up eating mostly dough and sauce which were good! . n nIf Santa Lucia steps up and starts buying fresh ingredients to pair with their great pizza dough and sauces, it could really shine.",1
"note this review is about the two times i've been in the last week. RA use to be a regular spot for me when i lived in LA. i use to work lazy dog cafe and we'd all go after our shift. happy hours are awesome! n nvisit 1 my boyfriends parents were in town for his graduation. they were staying a TI and were looking for somewhere close to grab lunch. we figured RA would be a great place to check out and they have pretty awesome lunch specials. we sat in the dining room and our server was awesome! i cant say that for the host, exactly, but our server was definitely amazing! the bf's family is from hawaii and so is she, so they bonded fairly quickly . everyone ordered a bento, except for me i ordered the bara chirashi bowl and his dad ordered the viva las vegas roll . food was delicious! the bowl was SO filling! hamachi, salmon and tuna sashimi, rice and avocado. i barely finished it! it was a perfect lunch simple and satisfying. n nvisit 2 his parents had us watch their suite while they were away, and we wanted to go somewhere we could walk to. so RA happy hour it is! we ordered a tsunami punch fish bowl was 13 and the baby tsunami punch was 6. we were gonna get 2 anyway, so we opted for the regular price fish bowl . we also ordered short ribs, wings, salmon carpaccio, edamame and seaweed salad. bill was about 40. our server at the bar was awesome as well tracy . we needed a few boxes and still have quite a bit of our fishbowl left. i think she noticed we were full and the itis was about to kick in, and since its on the strip you're able to take your drink with you in a to go cup i had no idea that was possible! im so use to places saying no! . we left there full and completely satisfied. n nthanks RA sushi! n ndefinitely check out happy hour! quite a bit of tapas and rolls available on the menu, and some pretty awesome drink specials too! pictures to come soon! and i think i creeped out the guy who was sitting next to me. it was kinda dark in there, so every time i took a picture of my food, the bright flash from my blackberry went off. after we got our food, he switched to seat on the other side of the bar .",2
"AHHH this place is so bad. n nAll the times I have to be in this miserable airport I've seen this place, usually packed. I was able to sit down and try them out for breakfast last flight I took to Boston. n nBreakfast was awful. Their ingredients are not fresh. I was pained while trying to finish my food. Bloody Mary horribly made. n nThe decorations don't make up for food quality. Don't kid yourselves. On another note. it is airport food. I shouldn't have expected any better.",1
"Scale of 1 10 multiple visits n7 Food n10 Service n5 Atmosphere n8 Value n nYup, I can go from a review for Capital Grille, straight into an appreciative review for HDoaS. Because I'm a versatile mother fucker. n nDenigrating hats aside, this place is tasty. I love that it's simple, and I love that it's on the verge of cheap. And I love that their veggie dogs on a stick of course taste EXACTLY like regular ones. And while that veggie dog on a stick of course cooks, I go get an Orange Julius made up. Because I'm a versatile mother fucker.",2
"I've been to Yard House many times in Town Square. It's good place to go when you want to drink and catch up with friends while getting some good food. This was my first time at the location in the Linq. Everything was really clean, spacious, and lively. Aaron, our server, was friendly, made sure our waters were kept full and was very attentive. nI didn't really care for their jerk boneless wings. The sauce was on the side and I feel like it needed some breading, it was kind of weird. Parmesan crusted chicken was good. It had a mushroom and sun dried tomato sauce. My boyfriend got the New York Steak Sandwich so I had to steal a bite and it was good also! I thought it was going to be strips of steak but it's the actual full New York steak on a sandwich with tomato and onions. nSome of my favorites are the Mac and Cheese, definitely not your typical Mac and cheese. It has truffle oil and it is just delicious! I also like almost all of their burgers, I've yet to try their late night truffle burger you can tell I'm a sucker for truffle lol . I also really love their grilled cheese and tomato bisque. The bisque has a nice basil flavor and I always add bacon to the grilled cheese, because well, everything's better with bacon right? For appetizers I love the nachos. It's a really big portion though, maybe too big for only two people. I also really like the lobster, crab, and artichoke dip. nFor drinks, I usually get one of their martinis or specialty drinks and I've yet to be disappointed! Overall I love this place and will definitely be coming to the linq location more often!",2
"I have been to both the downtown and the South Side McCormick Schmick's several times. They rarely disappoint. n nTheir menu is quite extensive, changed daily to reflect seasonal fish and ingredients. I always choose something interesting from their cocktail menu, as they have a scratch bar with fresh ingredients. n nMcCormick's has some very good soups and several salads to choose from, although they cost extra to add to your entree. I will admit that many of their appetizers don't tickle my fancy. I do, however, love the crab dip. It is great for sharing. If you like oysters, they have over 5 varieties available on the half shell. Their mussels are also excellent. n nIf you are there for lunch, they have over ten entrees for under 10, which is a pretty good deal. n nMy favorite dinner entree is the Salmon stuffed with crab, shrimp, and brie. The serving size is rather small, but the taste is wonderful! n nThey also have an extensive wine list and delicious dessert menu. Try the chocolate bag with passion fruit mousse and fresh berries. It's divine!",2
"My boyfriend and I wanted to have a fancy night out, without wandering too far afield. Atrias fit the bill. We were seated promptly without a reservation. Our server Angelina maybe Angelique was phenomenal. We each got something from the bar. He was offered a frosted glass with his newcastle, and my margarita 5 margarita night was delicious. Our meals were delivered promptly. He ordered the seafood pasta and I got the ahi tuna Both were delicious. My ahi tuna was particularly exceptional. n nThe waitstaff was very friendly, and while we were there, the manager was visable on the floor. As someone who as worked in the service industry, I find this is usually a good thing. n nWe will definitly go again!",2
"If I could give this company a zero rating, I would. Dealing with this management company is just a nightmare. Our hallways, stairwells, and foyer have not been swept and mopped in months. Our garbage shoot is backed up to our floor, which is the second floor. It has caused a rodent problem, not only in the trash area, but in each unit. We were watching television the other night when we heard a squeaking sound. We looked up and there was a mouse on the ledge overhanging our twelve foot ceiling. Just disgusting! Who wants to have to worry about rodents and garbage overflowing in the garbage shoot. I and others have called multiple times to get the place swept and the trash and dust bunnies just keep piling up. It is starting to look like a housing project and the property is approximately five years old. DO NOT USE THIS MANAGEMENT PROPERTY OR YOU WILL BE SORRY!",1
"I loved lobster me before the menu change. I have no issue paying 23 27 for a large lobster roll, but I won't pay 17 for what amounts to a lobster slider. The quality of the meat and bread is great, but the size available now is great if you're a child or over 85 and don't eat like an adult. Last visit.too bad.",1
