text,label
" WARNING BAD CONTRACTOR n nNot only is Marco the worst contractor I have ever dealt with, he also kept trying getting more money for everything we had already agreed on. He was unprofessional, incompitent, constantly late or no showing and tried to blame me for everthing he screwed up. n nThe whole job was completed and looked like hell. The bricks were just laid on the ground instead of cemented in so they were uneven, loose and sinking into yard. The sod had sat in rolls for 6 days so you can imagine how that looked. The yard was a bog because he didn't level and grade it correctly. And to top it off he damaged my house and brick walls with his bobcat. n nAfter I saw how poorly the job was done I threatened to file a claim against his bond with the Register of Contractors and he came over pounding on my door. He literally told me that if I wanted the job done right I should have paid him more needless to say I lost it. After a heated exchange I wrote an amended contract for all the things he would need to fix and he signed it. n nHe had his Mesa crew chief come out and in one day with a full crew and they fixed his terrible job. This guy was good on his word and the backyard is. acceptable. The rocks are still not evenly spread but by this point I just wanted them gone. A job that should have taken 2 3 days had taken over 2 weeks and a good portion of my sanity. n nWord to the wise. DO NOT HIRE THIS COMPANY.",1
"I read what seemed to be mostly positive reviews on this restaurant that has been at Desert Ridge long enough to be established. I'll start with the positives. the sweet potato fries were good and the water was wet and cold. The ribs, while okay, were cooked sans sauce, per restaurant standard, but not with the sauce we asked for on them. The 8 pulled pork sandwich was terrible, again sans sauce. The Ruben's pastrami was inedible and my wife's Mandarin Chicken salad was very mediocre. She likes very dry chicken, and this was TOO dry for her. We happened to dine there at the same time as some friends. They too were first timers, who vowed to never return. To end on a positive, the staff was generally friendly and service was fine. I left the restaurant smelling like I just came back from a camping trip.",1
"We have a feeling the ""Hollywood "" theme is definitely more up to date and appropriate in the US than the Arabic theme right now. Such are the realities in the seventh year of the second millennium. The new facelift seems promising. Good vibe overall, in spite of the mess outside and the incomplete transition from Alladin's badly interpreted Arab kitsch to a Hollywood bling bling kitsch. Can't wait to see the final result in a few months. n nRooms are clean overall, and have no heavy stench that is otherwise typical for most hotels on the South Strip. Bathrooms are nice too. Separate toilet, shower and a good size 2 person bath tub that comes handy to relax two tired bodies that have been slaving out badly during the heavy workweek back in LA. n nHowever, we did found some ""artefacts "" from previous visitors a few long thick black hairs, clearly from an Asian woman . sigh. Nothing is perfect. So we lowered the star rating to 4 for that reason. So far this is the only thing that disturbed our trip. But hey, we are still here we never know what else can go wrong. right?",2
"Ok I give the park 3 stars but 1 star for the surf hour it's a bummer because of the locals that go there. The guy that runs the surf shop is a d bag. Me and my buddy were sharing my board so I would wait in line till there session was done and then he would bring the board to me and vice versa. So I waited in line my buddy brings my board to me and mr surf shop says I need to go to the back of the line if I'm sharing a board and wait. I just waited I told him and I'm not going to the back of the line, he said its a rule. I asked who's rule? He said its an unspoken rule the regulars made. Kiss my. I just waited and you want me to wait again just cause I'm sharing a board what kind of bs is that I paid money to ride just like everyone else. If you want to have fun don't surf here, not worth the wait or the bs or the 3 second ride or the money.",1
"The only reason I come here.it's closer to me than the one in Tempe. n nOtherwise, I would recommend the Tempe BE. The quality of clothes are better the prices are better. I actually see no name brand shirts with tags from Ross priced at like 14. Umm, I'd rather go to Ross and pay 7 for the shirt. The jean prices are a little higher here as well. And less sale items.",1
"Yoga Hive is my favorite studio in PGH. I love the comfortable atmosphere, the energetic teachers and the friendly community. My first entry to the Hive was their awesome 10 2 week first timer grand opening special. I got to try out the different teachers and style of classes. I love their asana classes which span from Beginner Intro classes, calm ""Strong and Steady "", to more invigorating Power Yoga. I'm also a huge fan of the meditation and sound healing classes as well as the Full Moon Gong Meditations. n nCheers to Kimberly for being an inspiring yoga teacher and cheers to PGH for being lucky enough to host this great studio.",2
"After all the hype this was an overpriced disappointment. I orderd the griddlecakes with milk and coffee to drink. I also ordered a side of bacon as several reviewers recommended it. Including tax but not tip my total for breakfast was 16.01. n nThe pancakes tasted like Bisquik and the bacon was crispy black and looked and tasted like the cheap grocery store bacon you buy in the shrink wrap packages. Even funnier the ""three pieces "" were actuallly only 1 2 pieces of bacon at around 4 "" long. Overall I've had much better breakfasts at The Good Egg and First Watch at a lower price. n nAnother disappointment was waiting for me in the parking lot. An employee had parked her white Volvo behind my car and blocked me in. I first waited for her to finish unloading the car, assuming she would move the car after she was done. Instead she came out once more, closed the the trunk and went back inside. I had to go back inside and ask her to move. The employee did finally move her car but she didn't bother to apologize.",1
"Arrived here at 6 30 AM on Sunday morning. n nIt was depressing. The patrons and some of the staff just made me sad. n nI won't get into details, but it was soul crushing. It put me off my feed and I had to leave. n nIf they had legal gambling and the bars were open 24 7 in my hometown, I'm sure there would be plenty of depressing bars as well. n nI'll be back during the day to try the food just couldn't do it on this trip. n nDon't come here during the graveyard shift.just don't",1
"Celebrated a family member's birthday here last night. A place she's been wanting to try for a while and I'd never heard of before. Our party consisted of 20 people and I must say we all could not have had a better time. The food was great I tried the Pollo Rico and my wife had the Mesquite Tacos excellent!. What gets the 5th star is our amazing waitress, Charlene. Even with our large party she was attentive and managed to keep our drinks full and she got our orders out quickly and took very good care of us until our party ended and this, on a very busy Saturday night. We will definitely be back and highly recommend Nando's!",2
"So lovely to visit this airport! I adore the huge open center with huge windows in the middle of the terminals that you will most likely see if you are hitting a connection but you will see it quickly and at an interesting speed! n nI love the white rocking chairs, they remind me of being in the Philadelphia Airport. Also, we NEED to talk about the bathrooms.they have bathroom attendants here. WHAT?!?! I felt like I was at the really nice nightclub of airports. I was confused when she was there with mints and hairspray askin ""Hey Darlin, how is your trip going? "" UMMMM AND YOU ARE A Sweetheart? So lovely! Love this touch. It was a nice addition to the very clean bathrooms and airport overall. n nI have only been through this airport quickly so I hope my next layover is a little longer so that I can walk around instead of literally running through. However, be careful of what you wish for watch next time I will get stuck crosses fingers n nI really do wish all airports were as lovely.i mean why wouldn't you create a nice structure if you know everyone from all over the world are going to be frequenting it?!? Common sense to me if you ask.",2
Service was ok but not inviting. The country fried steak was terrible. We also has the BLT sandwich which was good. The fries and hash browns were plain. They have a cheap lunch menu but I will not return to try it.,1
"Southern hospitality? Yes ma'am or Mister n nThe first thing that struck me was that my server had a lovely accent. nMy daughter looked at me asked me if it was part of her job to fake an accent, I went with no. I'm not sure where it's from, but it's a 'honey y'all' accent D She had a very friendly disposition made our lunch experience a pleasure. She made her mama proud. n nThe food was decent AND you can have breakfast all day. I love having breakfast for dinner, so that's a big selling point to me n nThe building is fairly new, not too brightly lit clean. n nIn all honesty I would have given them an A OK rating, 3 stars, but our server pushed them to a 'yay! I'm a fan', 4 star rating. nGood people make the difference!",2
"Never again. I should have known not to stray from Thai taste, but I figured if give them a shot since I live between the two. First of all, they took my order over the phone and I had to call them back to give them my payment and spice level. They arrived with the food pretty fast, so I was willing to forgive the initial interaction. My boyfriend said it seemed light for what we ordered. We opened the bag and a LIVE BUG crawled out of the bag! The we realized they had forgotten half of our order, not that we had an appetite after the bug. After not being able to reach them by phone, we jumped in the car and sped off to take to food back and get our money back. They were closed and unreachable. The food now sits in my car waiting to go back to its home tomorrow. Yuck, gross, ew.",1
"I had the shrimp tacos, my niece had the El Green Go Burrito. They charge for chips and salsa. and for me anyone who charges for chips and salsa is lame. I'm from houston and we have the best mexican texmex food around, so as far as the food goes its just 2 stars for me. n nThe shrimp tacos were good, but just ok. same with the rice and beans. I've had better. Too many other great food places in vegas to spend money here. My niece said her food was good, but also mediocre. probably wouldn't be a repeat for me. n nThe staff was very nice. that was probably the best part of the experience. That is all. ",1
"Although our view of the fountains were spectacular, I found the room to be dingy, old, and small, compared to the Wynn or Encore. Also, since we were taking the red eye back to Boston, I paid for an extra half day until 6pm on a Friday. At 5 45, my daughter and sister tried to get into the hotel room, and it was locked our keys turned off! The security guard could not reach a manager, and would not let us in to get our luggage, even after I showed them my receipt and my ID. I was furious. I called the front desk several times before I got the ""on call "" manager. She apologized, and refunded my fee for the half day. Meanwhile, she said we had a limo ride to the airport, all taken care of ""just go to the bell man out front they have your name "". Needless to say, when I went there, they had no idea what I was talking about, so I again tried to reach a manager in vain. It is apparent that one hand has no clue what the other is doing in this large hotel God forbid, if there was an emergency in a room they wouldn't let you into your own room! We ended up taking a cab to the airport. The manager did call me again after I reached the airport to apologize for a second time about the lack of communication. You can always walk by the fountains I do not recommend staying here if you are used to first class service and excellent, modern accommodations.",1
"I know I know. It's like a sin for me to have Panda Express because I'm Asian. But, in the city of sin, it's okay to commit sins, right? At least that was my logic although I also eat Panda Express outside of the city of sin, but that is not the point! n nI was looking for some comfort food and was craving white rice, fried rice, or chow mein. We walked in and I was a little bit giddy. I always order the Chicken and String Bean, so I got that and my friend picked the Pepper Chicken. We shared one of those two entree dealios with half chow mein and half fried rice. n nThe lady at the cash register was a little bit rude. I asked if I could have an extra plate for us to split the meal and she looked at me like I was crazy. We didn't get any napkins, so I asked her if I could have some. As she's staring at the register, she waves me off and says ""behind you. "" Okay lady. n nI sat down, smelled the food, and smiled. I only had a banana and some tater tots for breakfast brunch and it was about 2 30PM, so I was starving! I took a bite of the chicken and string bean and it totally hit the spot. I pretty much devoured my half of the food, and sat there rubbing my little food belly. n nWe had a bunch of different tasks to get done for the Bachelorette Party Bridal Shower, so a quick and yummy meal was perfect. n nJust an FYI, this is inside the Planet Hollywood Hotel Casino in the Miracle Mile Shops area.",2
"After posting my previous review about my 1 star experience on New Year's Eve, I was contacted by an employee offering to have me back for another meal and to refund my poor experience. I happily accepted, as I'm open to giving people more than just one shot. n nUnfortunately, they messages they sent me were deleted not by me. and my attempts to contact them directly at the email address provided in the message have gone ignored. n nNot only was my experience with their restaurant very poor, my experience with their customer service after the fact has been extremely disappointing as well. I can not stress enough how poorly I rate this establishment.",1
"I have been coming here since the new owners took it over in May and I will not go any where else. Larry and Kate have created a wonderful spa to come get nails, toes, eye brows, facials, all kinds of waxing. I always bring in crazy pictures of nails and they make them happen no matter what. This picture is from today.",2
"How much fun is this place? My husband's company management has been talking about doing a corporate function here so we thought we'd stop in and get the membership cards out of the way. I love that there was a woman up front to greet us and guide us where we need to go. Byron took excellent care of us at the membership counter and he's a fellow Iowan and Hawkeye fan so he's got my vote for Employee of the Month. n nThen we walked around and checked out everything. We really liked how roomy each section is with plenty of seating and a couple of TVs. The range looks like a lot of fun with a variety of targets, and I also noticed how clean everything was. n nWe cruised through the bar and noticed there are some large booths with their own TV so you can sit with your group and watch your game of choice. They also have a gaming area for those not swinging a club. There were a lot of staff around and they were smiling and making sure people had what they needed, or answering any questions. n nWhile on the way to the restrooms I noticed they have some meeting rooms and one group had booked one for their fantasy league draft. We got a look at their catered food of wings and some other munchies and it all looked and smelled delicious. I didn't snag any as I walked by, I swear! n nEven though my golf clubs are only in the house as potential weapons now and I call myself a reformed golfer, I would definitely look forward to a corporate event or night out with out of town guests at Topgolf. GREAT place!",2
"How many different ways can I say ""food poisoning "". I know.it's shocking.a Michelin star and all.but it's true. The only thing I ate that my husband did not was their ""signature "" Maytag blue cheese souffle. I woke up the morning after regretting ever having stepped into the restaurant. It was violent. I guess it can happen anywhere. To tell you the truth, the most shocking part of the experience was the total apathy of the restaurant management. I called to inquire let them know. They promptly referred me to ""security "", who referred me to ""risk management "", who blew me off. I guess they won't respond unless my lawyer calls. Craziness.",1
I'm fairly surprised at how many good reviews on this are here. This place was absolutely disgusting! The food was so bland and tasted like it had been sitting for a couple days. We should have known better when we walked in and the owner was sitting there picking his ear! The waitress lady was nice but the food was horrid and we all felt sick afterwards. This place was recommended by a friend and now I have to murder her! STAY AWAY!,1
Let's see. their food is not very good. I like to eat plain cheese pizza or with pepperoni at the most. All their sausage meats are horribly salty which sucks so pepperoni pizza is very difficult for me to eat. It really helps to add veggies on it. n nTheir new chicken advertised on TV was so gross. It has an odd odor and once you take a bite of that round nugget a bunch of oily gelatin comes out. The kickers are a lot better. They could also try training their drivers to hold the pizza correctly so that the toppings are still on the crust and not on the box. I thought the CEO didn't want to see any more bad pictures of their pizzas when we send them in. Why can't my friends stop insisting that we eat here? LOL,1
"Wow. A gem near my house. I'd never been there til a friend wanted to meet up. We're craft beer drinkers and there was a ton of draft. It was late at night and the one I wanted was out, but they had a ton more. n nI'm also a burger guy and the burger was awesome. They gave me exactly what I wanted, and bartender waitress came by just enough to be attentive and not annoying. I felt very welcome here, got exactly what i ordered, was offered a sample of a few beers before I bought, and was able to watch four large screen HD tvs showing the ball games and Olympics. Great place . I'll be back.",2
"The reviews here are spot on. The best pad thai in C U if not the best pad thai that I've had period. I remember eating here my freshman year when my cousin brought me here. I had a craving for some pad thai, so I decided to come here again. Ordered an order of shrimp pad thai. I usually order beef pad thai wherever I go, but I decided I would try something different. Very large portion, easily enough for two meals. Great flavors as well. My only gripe is that they left the tails on the shrimp, so I was faced with the option of picking them off, which is a pain or just eating the tails on. I went with the latter, which wasn't a big issue, but still undesirable. Next time I'll be ordering beef pad thai.",2
"One liner Super clean, super friendly. n nThey do a GREAT job here for massages. They will listen to exactly what you need and want and try to meet your needs. n nOne hour massage is 70, so comparable to other locations.",2
"I stayed here for a conference in September and stayed in a concourse room. I was unimpressed with the hotel. n nThe lobby would most likely be magnificent if it were bigger. There is a grand staircase as the centerpiece but it feels like the whole lobby was mini scale. n nMy room was on the 5th floor. When I got off the elevator I immediately noticed an ""old "" smell like an old persons house. The decor was incredibly dated, I'm guessing 50's? And not in a kitschy way, this was probably a nice hotel the year my parents were born. n nMy room was no better. Ancient decor, funky smells. The only nice thing was the size. It was a spacious room however I cannot understand why the bathroom was so small. You had to straddle the toilet to open the door. n nThe beds were incredibly soft so if that's your thing, you'll be ok. Either way, you will find it impossible to sleep due to the freight train like HVAC unit in the room. Not onlynwas it as loud as a jet every time it kicked on, it was maddening to set. It was slow to respond and inconsistent with the temperature. I would be comfortable and then all of a sudden it was blazing hot in the room. n nThe shower was adequate but had low pressure. The size of the bathroom really was a downside. But since you can't leave the door open and shower you would not be able to exit the shower they did have fans in the bathroom. That helped with the humidity. n nI ordered room service one night and the food was average. I ordered hummus pitas and a white bean burger. The hummus was good, though a little thick. The burger was decent. The bun was fantastic. The burger needed something, I just couldn't place what it needed. It was delivered incredibly fast. They told me 20 minutes but it was delivered in less than 10. The waiter was really nice too. n nI stayed at Cambria last time and would go back there instead of here next time.",1
"This place is definitely 5 star quality food, but simply slow service. Expect to wait a while before you sit, and then wait a long time before your food comes. Breakfast on the weekend will be about a 2 hour ordeal. n nHaving said that the food is fantastic, all sauces are homemade daily. Everything is fresh, large portions. Their bloody marys and mimosas are excellent. I'm partial to choosing ""Green Flannel "" for breakfast, and without a doubt you must get ""The Rustler "" for the single best lunch sandwich in the history of lunch sandwiches. n nI have brought every out of town visitor there for several years and they always say ""that's the best sandwich I've ever had "". So go give it a try. If you don't want the Rustler, try the Bitchin' Chicken. n nI've never been there in the evening, but I intend on going for microbrews and live music sometime soon.",2
"WORST HOTEL IVE EVER STAYED AT IN VEGAS! n nFirst, housekeeping stole a 100 bill out of my wallet when they did the turn down service i dont gamble so I know I didn't spend my n nSecond, my key was deactivated about 15 times during my 4 night stay and the keys wouldnt even work when I would go down to the concierge and ask for a replacement so every time I wanted to get into my room I was at the mercy of security to let me into my own room. This was extremely inconveniencing at 2pm, 5pm, and 2am especially when security took their sweet time upwards of 30 minutes to let me into my room. n nTHEN, after I complained, one of the managers said I could have a 40 room credit which I planned to use on room service after I had gotten off work. I ordered a SALAD at 12am hoping it would arrive in an hour.no. Two hours later, I called to cancel my order because I was going to bed.starving. n nFinally after that charade happened, I left a dress in another room. I called 2 weeks later wondering if it had been turned into lost found. Immediately the lady on the other line said it wasn't there and they only keep items for 14 days. Remind you, she hadn't asked what my checkout date was or for a description of the dress. So rude. I never wish a stay at the Aria upon anyone. Its aesthetically pleasing but the customer service is worse than Circus Circus. A bunch of selfish clowns who could care less about their consumer.",1
"Finally, I've found a cheesesteak place in Vegas that gets it right. Wiz, Amoroso rolls, steak and onions. Classic. n nPop's even has the look and feel of an authentic Philly Cheesesteak place order at the window, outdoor seating, food served in baskets. n nNo question about it, if you're looking for authentic Philly cheesteaks, this is the place. Anyone who doesn't like these sandwiches also wouldn't like Pat's or Geno's or Jim's from Philly.",2
Dr. Wilson is awful. I read the review of the person who had a hysterectomy there 3 years ago and is still having issues. . Well join the club I'm 1.5 years post op from her butchering hands and I had to have a second surgery by another doctor. I'm better but still have pain. They removed non dissolvable stitches that she uses and a hematoma. She is awful. Run don't walk away from this doctor!,1
